{
  "base_url":"https://github.com/tfadeyi/my-app",
  "description":"Sample application",
  "errors_definitions":{
    "error_something_code":{
      "code":"error_something_code",
      "summary":"This is a summary of the error that will wrap the application error.",
      "title":"Error On Something"
    }
  },
  "name":"my-app",
  "title": "My Application",
  "version":"v0.0.1"
}